{
  "$schema": "../../spec.schema.json",
  "name": "Tooltip",
  "family": "tooltip",
  "description": "Trigger-anchored explanation bubble ‚Äî a small contrast-toned surface with a caret that points at the host element. Two appearances: `default` (primary/onPrimary) is the brand-blue tooltip used by default, and `inverse` (inverseSurface/inverseOnSurface) for screens already saturated with primary tone. Optional action slot accepts a small text button bound to the matching `onPrimary` or `inverse` appearance.",
  "element": "div",
  "props": {
    "children": {
      "type": "node",
      "required": true,
      "description": "Body text ‚Äî a short hint or label. Wraps within the max-width cap. Tooltip copy may run longer than a button label, but should stay intuitive at a glance."
    },
    "appearance": {
      "type": "enum",
      "values": [
        "default",
        "inverse"
      ],
      "default": "default",
      "description": "`default` paints the bubble in `primary` with an `onPrimary` foreground ‚Äî the brand-blue tooltip. `inverse` paints in the inverse cluster (`inverseSurface` / `inverseOnSurface`) for use on screens already saturated with primary tone, where the brand-blue bubble would compete with the surrounding chrome."
    },
    "placement": {
      "type": "enum",
      "values": [
        "top-start",
        "top",
        "top-end",
        "bottom-start",
        "bottom",
        "bottom-end"
      ],
      "default": "top",
      "description": "Where the bubble sits relative to its trigger. The `<edge>` axis (top / bottom) chooses whether the bubble floats above or below the trigger and which edge the caret renders on. The `<align>` axis (start / center / end) shifts the caret along the parallel axis so it lines up with an off-centre trigger ‚Äî pick `-start` when the trigger sits near the leading edge of the viewport, `-end` when it sits near the trailing edge, and the bare edge name when the trigger is comfortably centred. Left/right placements are intentionally not in the enum ‚Äî Tooltip is a top/bottom affordance; for side-anchored disclosure surfaces reach for a popover-style host instead."
    },
    "action": {
      "type": "node",
      "optional": true,
      "description": "Optional Button node rendered after the body. Canonical bindings: `<Button variant=\"text\" size=\"small\" appearance=\"onPrimary\">` for the `default` (primary) tooltip, or `<Button variant=\"text\" size=\"small\" appearance=\"inverse\">` for the `inverse` tooltip ‚Äî so the label paints in the correct on-host token in either theme. Layout: inline-trailing when the body fits on one line; stacks below the body once the body wraps."
    }
  },
  "slots": {
    "container": {
      "required": true,
      "description": "The bubble surface with the caret. Appearance-bound fill, overlay elevation, lg-radius. role='tooltip'.",
      "intrinsic": true
    },
    "caret": {
      "required": true,
      "description": "The pointer tail rendered on the edge facing the trigger. Inherits the container fill so the tail reads as one shape with the bubble. Edge flips per `placement` (top ‚Üí bottom-edge caret pointing down at the trigger; bottom ‚Üí top-edge caret pointing up); align (`-start` / `-end`) shifts the caret along the parallel axis.",
      "intrinsic": true
    },
    "body": {
      "required": true,
      "description": "The hint copy. `body.sm` / Regular / inherits container foreground. Wraps within the bubble's fixed width ‚Äî the bubble is not content-driven (see `sizing.widthContract`), so short copy reads at the same footprint as wrapping copy.",
      "accepts": [
        "text"
      ]
    },
    "action": {
      "required": false,
      "description": "Optional slot accepting a Button node. Canonical bindings: `Button variant=\"text\" size=\"small\" appearance=\"onPrimary\"` (default tooltip) or `appearance=\"inverse\"` (inverse tooltip). Inline next to the body when the body is single-line; drops below the body once the body wraps. Inline gap from body = `ref.space.150` (12); block gap when stacked = `ref.space.75` (6) so the wrapped action reads as part of the same group rather than a new row.",
      "accepts": [
        "button"
      ]
    }
  },
  "sizing": {
    "minHeight": "ref.space.400",
    "maxWidth": "240px",
    "widthContract": "The bubble always fills the available channel ‚Äî never content-driven. Computed width = `min(maxWidth, parentChannelWidth)`, where `parentChannelWidth` is the host channel the owner positioner exposes (production: `viewport width - 2 √ó viewportSafeArea`; in-page demo: the parent block's content-box width). Short body strings get the same bubble footprint as long ones; the body just doesn't wrap. The cap stays at 240; below the cap the bubble stretches to the safe-area channel so the caret-to-edge geometry stays balanced on narrow viewports.",
    "radius": "sys.radius.lg",
    "paddingInline": "sys.layout.container.sm",
    "paddingBlock": "sys.layout.container.sm",
    "actionInlineGap": "ref.space.150",
    "actionBlockGap": "ref.space.75",
    "triggerOffset": "sys.layout.stack.xs",
    "viewportSafeArea": "sys.layout.container.xs",
    "caretSize": "ref.space.100",
    "bodyTypo": "sys.typo.body.sm"
  },
  "appearances": {
    "default": {
      "background": "sys.color.primary",
      "foreground": "sys.color.onPrimary",
      "elevation": "sys.elevation.overlay",
      "note": "Brand-blue bubble with an always-white label. Both `primary` and `onPrimary` are theme-stable, so the bubble reads the same in light and dark mode. Action buttons inside this appearance MUST use `Button variant=\"text\" appearance=\"onPrimary\"` so the label stays white in either theme ‚Äî `appearance=\"inverse\"` flips with the theme and would render the label dark in dark mode."
    },
    "inverse": {
      "background": "sys.color.inverseSurface",
      "foreground": "sys.color.inverseOnSurface",
      "elevation": "sys.elevation.overlay",
      "note": "Inverse-cluster bubble for screens already saturated with primary tone, where the `default` brand-blue tooltip would compete with the surrounding chrome. Action buttons inside this appearance use `Button variant=\"text\" appearance=\"inverse\"` so the label flips with the host fill."
    }
  },
  "behavior": {
    "lifecycle": "Presentational. Owner code mounts the Tooltip while the trigger is hovered or focused, and unmounts it when the trigger loses both. Typical reveal delay is ~400ms on hover (immediate on focus); the component does not manage the timer.",
    "role": "Container carries role='tooltip'. The trigger MUST own `aria-describedby` pointing at the tooltip's id so screen readers associate the hint with the host element.",
    "placementSelection": "Pick `placement` so the bubble fits the trigger's position on the viewport: when the trigger sits near the leading edge of the viewport, use a `-start` aligner so the caret stays anchored to the trigger while the bubble extends inward; mirror for the trailing edge with `-end`. The `top` / `bottom` edge choice depends on which side has room ‚Äî typically `top` when the trigger sits in the bottom half of the viewport, `bottom` when it sits in the top half. The owner positioner is responsible for collision-flipping (`top` ‚Üí `bottom` when the bubble would clip).",
    "viewportSafeArea": "The bubble (chrome + caret) MUST keep at least `sys.layout.container.xs` (8) clear of the viewport edge on every side ‚Äî same 8/8 horizontal safe area Toast pays. The owner positioner enforces this; when honouring the safe area would push the bubble off its preferred placement, flip to the opposite edge before nudging within the safe area. The bubble's own width is `min(maxWidth, viewport width - 2 √ó viewportSafeArea)` so the safe channel and the cap meet cleanly at narrow widths.",
    "triggerOffset": "The caret tip sits `sys.layout.stack.xs` (8) away from the trigger's bounding box ‚Äî same `stack.xs` rung the rest of the system uses for vertical breathing room between an anchor and a floating element. The owner positioner applies this offset when placing the bubble.",
    "widthFill": "The bubble always fills the available channel up to `maxWidth`. Short body strings render at the same footprint as long ones; the body just doesn't wrap. This gives the caret-to-edge geometry a predictable rhythm regardless of copy length ‚Äî a 'Got it' single-word tooltip lands at the same width as a wrapping multi-line hint."
  },
  "forbidden": [
    "Tooltip used as a non-blocking confirmation ‚Äî that role is the `toast` family",
    "Tooltip rendered without a trigger anchor ‚Äî tooltip is always anchored to a specific element via the trigger contract",
    "Tooltip persistent (no auto-dismiss on blur / pointer-leave)"
  ]
}
