{
  "$schema": "../../spec.schema.json",
  "name": "Tooltip",
  "family": "tooltip",
  "description": "Trigger-anchored explanation bubble — a small contrast-toned surface with a caret that points at the host element. Two appearances: `default` (primary/onPrimary) is the brand-blue tooltip used by default, and `inverse` (inverseSurface/inverseOnSurface) for screens already saturated with primary tone. Optional action slot accepts a small text button bound to the matching `onPrimary` or `inverse` appearance.",
  "element": "div",
  "props": {
    "children": {
      "type": "node",
      "required": true,
      "description": "Body text — a short hint or label. Wraps within the max-width cap. Tooltip copy may run longer than a button label, but should stay intuitive at a glance."
    },
    "appearance": {
      "type": "enum",
      "values": ["default", "inverse"],
      "default": "default",
      "description": "`default` paints the bubble in `primary` with an `onPrimary` foreground — the brand-blue tooltip. `inverse` paints in the inverse cluster (`inverseSurface` / `inverseOnSurface`) for use on screens already saturated with primary tone, where the brand-blue bubble would compete with the surrounding chrome."
    },
    "placement": {
      "type": "enum",
      "values": [
        "top-start", "top", "top-end",
        "bottom-start", "bottom", "bottom-end"
      ],
      "default": "top",
      "description": "Where the bubble sits relative to its trigger. The `<edge>` axis (top / bottom) chooses whether the bubble floats above or below the trigger and which edge the caret renders on. The `<align>` axis (start / center / end) shifts the caret along the parallel axis so it lines up with an off-centre trigger — pick `-start` when the trigger sits near the leading edge of the viewport, `-end` when it sits near the trailing edge, and the bare edge name when the trigger is comfortably centred. Left/right placements are intentionally not in the enum — Tooltip is a top/bottom affordance; for side-anchored disclosure surfaces reach for a popover-style host instead."
    },
    "action": {
      "type": "node",
      "optional": true,
      "description": "Optional Button node rendered after the body. Canonical bindings: `<Button variant=\"text\" size=\"small\" appearance=\"onPrimary\">` for the `default` (primary) tooltip, or `<Button variant=\"text\" size=\"small\" appearance=\"inverse\">` for the `inverse` tooltip — so the label paints in the correct on-host token in either theme. Layout: inline-trailing when the body fits on one line; stacks below the body once the body wraps."
    }
  },
  "slots": {
    "container": {
      "required": true,
      "description": "The bubble surface with the caret. Appearance-bound fill, overlay elevation, lg-radius. role='tooltip'.",
      "intrinsic": true
    },
    "caret": {
      "required": true,
      "description": "The pointer tail rendered on the edge facing the trigger. Inherits the container fill so the tail reads as one shape with the bubble. Edge flips per `placement` (top → bottom-edge caret pointing down at the trigger; bottom → top-edge caret pointing up); align (`-start` / `-end`) shifts the caret along the parallel axis.",
      "intrinsic": true
    },
    "body": {
      "required": true,
      "description": "The hint copy. `body.sm` / Regular / inherits container foreground. Wraps; soft cap at the max-width.",
      "accepts": ["text"]
    },
    "action": {
      "required": false,
      "description": "Optional slot accepting a Button node. Canonical bindings: `Button variant=\"text\" size=\"small\" appearance=\"onPrimary\"` (default tooltip) or `appearance=\"inverse\"` (inverse tooltip). Inline next to the body when the body is single-line; drops below the body once the body wraps. Inline gap from body = `ref.space.75` (6); block gap when stacked = `sys.layout.inline.lg` (12).",
      "accepts": ["button"]
    }
  },
  "sizing": {
    "minHeight": "32px",
    "maxWidth": "240px",
    "radius": "sys.radius.lg",
    "paddingInline": "sys.layout.container.sm",
    "paddingBlock": "ref.space.75",
    "actionInlineGap": "ref.space.75",
    "actionBlockGap": "sys.layout.inline.lg",
    "triggerOffset": "sys.layout.inline.sm",
    "viewportSafeArea": "sys.layout.container.md",
    "caretSize": "8px",
    "bodyTypo": "sys.typo.body.sm"
  },
  "appearances": {
    "default": {
      "background": "sys.color.primary",
      "foreground": "sys.color.onPrimary",
      "elevation": "sys.elevation.overlay",
      "note": "Brand-blue bubble with an always-white label. Both `primary` and `onPrimary` are theme-stable, so the bubble reads the same in light and dark mode. Action buttons inside this appearance MUST use `Button variant=\"text\" appearance=\"onPrimary\"` so the label stays white in either theme — `appearance=\"inverse\"` flips with the theme and would render the label dark in dark mode."
    },
    "inverse": {
      "background": "sys.color.inverseSurface",
      "foreground": "sys.color.inverseOnSurface",
      "elevation": "sys.elevation.overlay",
      "note": "Inverse-cluster bubble for screens already saturated with primary tone, where the `default` brand-blue tooltip would compete with the surrounding chrome. Action buttons inside this appearance use `Button variant=\"text\" appearance=\"inverse\"` so the label flips with the host fill."
    }
  },
  "behavior": {
    "lifecycle": "Presentational. Owner code mounts the Tooltip while the trigger is hovered or focused, and unmounts it when the trigger loses both. Typical reveal delay is ~400ms on hover (immediate on focus); the component does not manage the timer.",
    "role": "Container carries role='tooltip'. The trigger MUST own `aria-describedby` pointing at the tooltip's id so screen readers associate the hint with the host element.",
    "placementSelection": "Pick `placement` so the bubble fits the trigger's position on the viewport: when the trigger sits near the leading edge of the viewport, use a `-start` aligner so the caret stays anchored to the trigger while the bubble extends inward; mirror for the trailing edge with `-end`. The `top` / `bottom` edge choice depends on which side has room — typically `top` when the trigger sits in the bottom half of the viewport, `bottom` when it sits in the top half. The owner positioner is responsible for collision-flipping (`top` → `bottom` when the bubble would clip).",
    "viewportSafeArea": "The bubble (chrome + caret) MUST keep at least `sys.layout.container.md` (16) clear of the viewport edge on every side. The owner positioner enforces this; when honouring the safe area would push the bubble off its preferred placement, flip to the opposite edge before nudging within the safe area.",
    "triggerOffset": "The caret tip sits `sys.layout.inline.sm` (4) away from the trigger's bounding box. The owner positioner applies this offset when placing the bubble."
  }
}
